{
  "schema_version": "1.0",
  "policy_id": "policy-1",
  "created_at": "2026-05-13T12:00:00Z",
  "exclusions": {
    "industries": [],
    "company_names": [],
    "domains": [],
    "keywords": []
  },
  "outreach": {
    "allow_company_repeat": false,
    "allow_recipient_repeat": false,
    "company_dedupe_window_days": 365,
    "recipient_dedupe_window_days": 365,
    "require_manual_review_before_send": true
  },
  "limits": {
    "daily_send_limit": 5,
    "weekly_send_limit": 20
  },
  "review_thresholds": {
    "minimum_required_confidence": 0.7,
    "block_needs_review_required_fields": true
  },
  "forbidden_claims": []
}

